Sheet: Mountain list
A1: Name | B1: Country | C1: Physicogeographical region | D1: Elevation | E1: EE | F1: Coordinates | G1: Starting elevation | H1: ESE | I1: Starting point | J1: LPBE | K1: ELPBE | L1: LPBP | M1: LPAE | N1: ELPAE | O1: LPAP | P1: Final elevation | Q1: EFE | R1: Final point | S1: CT | T1: VA | U1: MVD | V1: MVR | W1: Other dates | X1: Other routes
A2: Teide (Pico del Teide) | B2: Spain | C2: Teide | D2: 3715 | E2: yes | F2: 28.2726931N, 16.6422742W | G2: 20 | H2: no | I2: 28.5721342N, 16.1921497W | J2: 0 | K2: yes | L2: 28.5752025N, 16.1888828W | M2: 0 | N2: yes | O2: 28.3714628N, 16.8707072W | P2: 130 | Q2: no | R2: 28.3703606N, 16.8482008W | S2: yes | T2: no | U2: 2025-03-17 | V2: https://mapy.com/s/hufategoba
A3: Pico Viejo | B3: Spain | C3: Teide | D3: 3129 | E3: yes | F3: 28.2639236N, 16.6646800W | G3: 20 | H3: no | I3: 28.5721342N, 16.1921497W | J3: 0 | K3: yes | L3: 28.5752025N, 16.1888828W | M3: 0 | N3: yes | O3: 28.3714628N, 16.8707072W | P3: 130 | Q3: no | R3: 28.3703606N, 16.8482008W | S3: yes | T3: no | U3: 2025-03-17 | V3: https://mapy.com/s/hufategoba
A4: Montaña de Igueque | B4: Spain | C4: Teide | D4: 2271 | E4: yes | F4: 28.3285200N, 16.4875550W | G4: 20 | H4: no | I4: 28.5721342N, 16.1921497W | J4: 0 | K4: yes | L4: 28.5752025N, 16.1888828W | M4: 0 | N4: yes | O4: 28.3714628N, 16.8707072W | P4: 130 | Q4: no | R4: 28.3703606N, 16.8482008W | S4: no | T4: no | U4: 2025-03-15 | V4: https://mapy.com/s/hufategoba
A5: Montaña Yegua Blanca | B5: Spain | C5: Teide | D5: 2251 | E5: yes | F5: 28.3237583N, 16.4920342W | G5: 20 | H5: no | I5: 28.5721342N, 16.1921497W | J5: 0 | K5: yes | L5: 28.5752025N, 16.1888828W | M5: 0 | N5: yes | O5: 28.3714628N, 16.8707072W | P5: 130 | Q5: no | R5: 28.3703606N, 16.8482008W | S5: no | T5: no | U5: 2025-03-15 | V5: https://mapy.com/s/hufategoba
A6: Montaña de la Negrita | B6: Spain | C6: Teide | D6: 2245 | E6: yes | F6: 28.3338328N, 16.4856706W | G6: 20 | H6: no | I6: 28.5721342N, 16.1921497W | J6: 0 | K6: yes | L6: 28.5752025N, 16.1888828W | M6: 0 | N6: yes | O6: 28.3714628N, 16.8707072W | P6: 130 | Q6: no | R6: 28.3703606N, 16.8482008W | S6: yes | T6: no | U6: 2025-03-15 | V6: https://mapy.com/s/hufategoba
A7: Montaña Ayosa | B7: Spain | C7: Teide | D7: 2076 | E7: yes | F7: 28.3550753N, 16.4667156W | G7: 20 | H7: no | I7: 28.5721342N, 16.1921497W | J7: 0 | K7: yes | L7: 28.5752025N, 16.1888828W | M7: 0 | N7: yes | O7: 28.3714628N, 16.8707072W | P7: 130 | Q7: no | R7: 28.3703606N, 16.8482008W | S7: yes | T7: no | U7: 2025-03-15 | V7: https://mapy.com/s/hufategoba
A8: Montaña Colorada | B8: Spain | C8: Teide | D8: 2070 | E8: yes | F8: 28.3401192N, 16.4824372W | G8: 20 | H8: no | I8: 28.5721342N, 16.1921497W | J8: 0 | K8: yes | L8: 28.5752025N, 16.1888828W | M8: 0 | N8: yes | O8: 28.3714628N, 16.8707072W | P8: 130 | Q8: no | R8: 28.3703606N, 16.8482008W | S8: no | T8: yes | U8: 2025-03-15 | V8: https://mapy.com/s/hufategoba
A9: Montaña de Joco | B9: Spain | C9: Teide | D9: 1956 | E9: yes | F9: 28.3688569N, 16.4650069W | G9: 20 | H9: no | I9: 28.5721342N, 16.1921497W | J9: 0 | K9: yes | L9: 28.5752025N, 16.1888828W | M9: 0 | N9: yes | O9: 28.3714628N, 16.8707072W | P9: 130 | Q9: no | R9: 28.3703606N, 16.8482008W | S9: no | T9: no | U9: 2025-03-15 | V9: https://mapy.com/s/hufategoba
A10: Montaña de Izmaña | B10: Spain | C10: Teide | D10: 1912 | E10: yes | F10: 28.3732672N, 16.4630233W | G10: 20 | H10: no | I10: 28.5721342N, 16.1921497W | J10: 0 | K10: yes | L10: 28.5752025N, 16.1888828W | M10: 0 | N10: yes | O10: 28.3714628N, 16.8707072W | P10: 130 | Q10: no | R10: 28.3703606N, 16.8482008W | S10: no | T10: no | U10: 2025-03-15 | V10: https://mapy.com/s/hufategoba
A11: Vrh Dinare | B11: Croatia | C11: Dinara | D11: 1831 | E11: yes | F11: 44.0624761N, 16.3829086E | G11: 220 | H11: no | I11: 44.0421933N, 16.1996103E | J11: 220 | K11: no | L11: 44.0407992N, 16.2003814E | M11: 220 | N11: no | O11: 44.0449786N, 16.2128928E | P11: 220 | Q11: no | R11: 44.0421933N, 16.1996103E | S11: yes | T11: no | U11: 2025-05-10 | V11: https://mapy.com/s/kohosofojo
A12: (Vrh Dinare – N summit) | B12: Croatia | C12: Dinara | D12: 1830 | E12: no | F12: 44.0630533N, 16.3834397E | G12: 220 | H12: no | I12: 44.0421933N, 16.1996103E | J12: 220 | K12: no | L12: 44.0407992N, 16.2003814E | M12: 220 | N12: no | O12: 44.0449786N, 16.2128928E | P12: 220 | Q12: no | R12: 44.0421933N, 16.1996103E | S12: yes | T12: no | U12: 2025-05-10 | V12: https://mapy.com/s/kohosofojo
A13: Morra Itote | B13: Spain | C13: Teide | D13: 1795 | E13: yes | F13: 28.3835911N, 16.4544283W | G13: 20 | H13: no | I13: 28.5721342N, 16.1921497W | J13: 0 | K13: yes | L13: 28.5752025N, 16.1888828W | M13: 0 | N13: yes | O13: 28.3714628N, 16.8707072W | P13: 130 | Q13: no | R13: 28.3703606N, 16.8482008W | S13: no | T13: no | U13: 2025-03-15 | V13: https://mapy.com/s/hufategoba
A14: kota | B14: Spain | C14: Teide | D14: 1756 | E14: yes | F14: 28.3953908N, 16.4276947W | G14: 20 | H14: no | I14: 28.5721342N, 16.1921497W | J14: 0 | K14: yes | L14: 28.5752025N, 16.1888828W | M14: 0 | N14: yes | O14: 28.3714628N, 16.8707072W | P14: 130 | Q14: no | R14: 28.3703606N, 16.8482008W | S14: no | T14: no | U14: 2025-03-15 | V14: https://mapy.com/s/hufategoba
A15: Montaña Chirigel | B15: Spain | C15: Teide | D15: 1748 | E15: yes | F15: 28.3979864N, 16.4232464W | G15: 20 | H15: no | I15: 28.5721342N, 16.1921497W | J15: 0 | K15: yes | L15: 28.5752025N, 16.1888828W | M15: 0 | N15: yes | O15: 28.3714628N, 16.8707072W | P15: 130 | Q15: no | R15: 28.3703606N, 16.8482008W | S15: yes | T15: no | U15: 2025-03-15 | V15: https://mapy.com/s/hufategoba
A16: El Gaitero | B16: Spain | C16: Teide | D16: 1748 | E16: yes | F16: 28.3947886N, 16.4332081W | G16: 20 | H16: no | I16: 28.5721342N, 16.1921497W | J16: 0 | K16: yes | L16: 28.5752025N, 16.1888828W | M16: 0 | N16: yes | O16: 28.3714628N, 16.8707072W | P16: 130 | Q16: no | R16: 28.3703606N, 16.8482008W | S16: yes | T16: no | U16: 2025-03-15 | V16: https://mapy.com/s/hufategoba
A17: Morra de Isarda | B17: Spain | C17: Teide | D17: 1711 | E17: yes | F17: 28.3902161N, 16.4434822W | G17: 20 | H17: no | I17: 28.5721342N, 16.1921497W | J17: 0 | K17: yes | L17: 28.5752025N, 16.1888828W | M17: 0 | N17: yes | O17: 28.3714628N, 16.8707072W | P17: 130 | Q17: no | R17: 28.3703606N, 16.8482008W | S17: no | T17: yes | U17: 2025-03-15 | V17: https://mapy.com/s/hufategoba
A18: Veľký Choč | B18: Slovakia | C18: Choč | D18: 1611 | E18: yes | F18: 49.1508658N, 19.3433819E | G18: 480 | H18: no | I18: 49.0834036N, 19.3090431E | J18: 480 | K18: no | L18: 49.0834036N, 19.3090431E | M18: 480 | N18: no | O18: 49.0834036N, 19.3090431E | P18: 480 | Q18: no | R18: 49.0834036N, 19.3090431E | S18: yes | T18: no | U18: 2025-03-07 | V18: https://mapy.com/s/homojelaze
A19: Montaña Cabezo de Toro (Montaña Cabeza de Toro) | B19: Spain | C19: Teide | D19: 1521 | E19: yes | F19: 28.4203647N, 16.4063283W | G19: 20 | H19: no | I19: 28.5721342N, 16.1921497W | J19: 0 | K19: yes | L19: 28.5752025N, 16.1888828W | M19: 0 | N19: yes | O19: 28.3714628N, 16.8707072W | P19: 130 | Q19: no | R19: 28.3703606N, 16.8482008W | S19: yes | T19: no | U19: 2025-03-15 | V19: https://mapy.com/s/hufategoba
A20: Cruz de Gala | B20: Spain | C20: Macizo de Teno | D20: 1348 | E20: yes | F20: 28.3109561N, 16.8238503W | G20: 20 | H20: no | I20: 28.5721342N, 16.1921497W | J20: 0 | K20: yes | L20: 28.5752025N, 16.1888828W | M20: 0 | N20: yes | O20: 28.3714628N, 16.8707072W | P20: 130 | Q20: no | R20: 28.3703606N, 16.8482008W | S20: yes | T20: no | U20: 2025-03-18 | V20: https://mapy.com/s/hufategoba
A21: Pico de las Flores | B21: Spain | C21: Teide | D21: 1313 | E21: yes | F21: 28.4302864N, 16.3913669W | G21: 20 | H21: no | I21: 28.5721342N, 16.1921497W | J21: 0 | K21: yes | L21: 28.5752025N, 16.1888828W | M21: 0 | N21: yes | O21: 28.3714628N, 16.8707072W | P21: 130 | Q21: no | R21: 28.3703606N, 16.8482008W | S21: no | T21: no | U21: 2025-03-15 | V21: https://mapy.com/s/hufategoba
A22: Risco Verde | B22: Spain | C22: Macizo de Teno | D22: 1312 | E22: yes | F22: 28.3063508N, 16.8266989W | G22: 20 | H22: no | I22: 28.5721342N, 16.1921497W | J22: 0 | K22: yes | L22: 28.5752025N, 16.1888828W | M22: 0 | N22: yes | O22: 28.3714628N, 16.8707072W | P22: 130 | Q22: no | R22: 28.3703606N, 16.8482008W | S22: yes | T22: no | U22: 2025-03-18 | V22: https://mapy.com/s/hufategoba
A23: kota | B23: Slovakia | C23: Choč | D23: 1299 | E23: yes | F23: 49.1380792N, 19.3338039E | G23: 480 | H23: no | I23: 49.0834036N, 19.3090431E | J23: 480 | K23: no | L23: 49.0834036N, 19.3090431E | M23: 480 | N23: no | O23: 49.0834036N, 19.3090431E | P23: 480 | Q23: no | R23: 49.0834036N, 19.3090431E | S23: yes | T23: no | U23: 2025-03-07 | V23: https://mapy.com/s/homojelaze
A24: Predný Choč | B24: Slovakia | C24: Choč | D24: 1250 | E24: yes | F24: 49.1221281N, 19.3381194E | G24: 480 | H24: no | I24: 49.0834036N, 19.3090431E | J24: 480 | K24: no | L24: 49.0834036N, 19.3090431E | M24: 480 | N24: no | O24: 49.0834036N, 19.3090431E | P24: 480 | Q24: no | R24: 49.0834036N, 19.3090431E | S24: yes | T24: no | U24: 2025-03-07 | V24: https://mapy.com/s/homojelaze
A25: La Montañeta | B25: Spain | C25: Teide | D25: 1151 | E25: yes | F25: 28.4441044N, 16.3811100W | G25: 20 | H25: no | I25: 28.5721342N, 16.1921497W | J25: 0 | K25: yes | L25: 28.5752025N, 16.1888828W | M25: 0 | N25: yes | O25: 28.3714628N, 16.8707072W | P25: 130 | Q25: no | R25: 28.3703606N, 16.8482008W | S25: no | T25: yes | U25: 2025-03-15 | V25: https://mapy.com/s/hufategoba
A26: Cumbre de Masca | B26: Spain | C26: Macizo de Teno | D26: 1058 | E26: yes | F26: 28.3156328N, 16.8410678W | G26: 20 | H26: no | I26: 28.5721342N, 16.1921497W | J26: 0 | K26: yes | L26: 28.5752025N, 16.1888828W | M26: 0 | N26: yes | O26: 28.3714628N, 16.8707072W | P26: 130 | Q26: no | R26: 28.3703606N, 16.8482008W | S26: no | T26: yes | U26: 2025-03-18 | V26: https://mapy.com/s/hufategoba
A27: Vysoká | B27: Czech Republic | C27: Východosoláňský hřbet | D27: 1024.2 | E27: yes | F27: 49.4039644N, 18.3609386E | G27: 566 | H27: yes | I27: 49.4192056N, 18.3200214E | J27: 561 | K27: yes | L27: 49.4198083N, 18.3181947E | M27: 561 | N27: yes | O27: 49.4198083N, 18.3181947E | P27: 566 | Q27: yes | R27: 49.4192056N, 18.3200214E | S27: yes | T27: no | U27: 2025-05-25 | V27: https://mapy.com/s/ponasamalu
A28: Cruz de Taborno | B28: Spain | C28: Macizo de Anaga | D28: 1024 | E28: yes | F28: 28.5365656N, 16.2689722W | G28: 20 | H28: no | I28: 28.5721342N, 16.1921497W | J28: 0 | K28: yes | L28: 28.5752025N, 16.1888828W | M28: 0 | N28: yes | O28: 28.3714628N, 16.8707072W | P28: 130 | Q28: no | R28: 28.3703606N, 16.8482008W | S28: no | T28: yes | U28: 2025-03-14 | V28: https://mapy.com/s/hufategoba
A29: Baracán | B29: Spain | C29: Macizo de Teno | D29: 1002 | E29: yes | F29: 28.3348425N, 16.8628028W | G29: 20 | H29: no | I29: 28.5721342N, 16.1921497W | J29: 0 | K29: yes | L29: 28.5752025N, 16.1888828W | M29: 0 | N29: yes | O29: 28.3714628N, 16.8707072W | P29: 130 | Q29: no | R29: 28.3703606N, 16.8482008W | S29: yes | T29: no | U29: 2025-03-18 | V29: https://mapy.com/s/hufategoba
A30: Pico del Inglés | B30: Spain | C30: Macizo de Anaga | D30: 995 | E30: yes | F30: 28.5334617N, 16.2642972W | G30: 20 | H30: no | I30: 28.5721342N, 16.1921497W | J30: 0 | K30: yes | L30: 28.5752025N, 16.1888828W | M30: 0 | N30: yes | O30: 28.3714628N, 16.8707072W | P30: 130 | Q30: no | R30: 28.3703606N, 16.8482008W | S30: yes | T30: no | U30: 2025-03-14 | V30: https://mapy.com/s/hufategoba
A31: Skalka | B31: Czech Republic | C31: Ondřejník | D31: 964.2 | E31: yes | F31: 49.5528097N, 18.3008689E | G31: 476 | H31: yes | I31: 49.5349139N, 18.2951678E | J31: 464 | K31: yes | L31: 49.5369014N, 18.2953061E | M31: 426 | N31: yes | O31: 49.5530086N, 18.3343358E | P31: 426 | Q31: yes | R31: 49.5530086N, 18.3343358E | S31: yes | T31: no | U31: 2025-02-16 | V31: https://mapy.com/s/fakolekudu
A32: (Matića guvno) | B32: Croatia | C32: Dinara | D32: 950 | E32: no | F32: 44.1009208N, 16.3007164E | G32: 220 | H32: no | I32: 44.0421933N, 16.1996103E | J32: 220 | K32: no | L32: 44.0407992N, 16.2003814E | M32: 220 | N32: no | O32: 44.0449786N, 16.2128928E | P32: 220 | Q32: no | R32: 44.0421933N, 16.1996103E | S32: no | T32: yes | U32: 2025-05-10 | V32: https://mapy.com/s/kohosofojo
A33: kota | B33: Czech Republic | C33: Soláňský hřbet | D33: 942.4 | E33: yes | F33: 49.4012356N, 18.3415464E | G33: 566 | H33: yes | I33: 49.4192056N, 18.3200214E | J33: 561 | K33: yes | L33: 49.4198083N, 18.3181947E | M33: 561 | N33: yes | O33: 49.4198083N, 18.3181947E | P33: 566 | Q33: yes | R33: 49.4192056N, 18.3200214E | S33: yes | T33: no | U33: 2025-05-25 | V33: https://mapy.com/s/ponasamalu
A34: kota | B34: Czech Republic | C34: Soláňský hřbet | D34: 938.9 | E34: yes | F34: 49.4024539N, 18.3514564E | G34: 566 | H34: yes | I34: 49.4192056N, 18.3200214E | J34: 561 | K34: yes | L34: 49.4198083N, 18.3181947E | M34: 561 | N34: yes | O34: 49.4198083N, 18.3181947E | P34: 566 | Q34: yes | R34: 49.4192056N, 18.3200214E | S34: yes | T34: no | U34: 2025-05-25 | V34: https://mapy.com/s/ponasamalu
A35: kota | B35: Czech Republic | C35: Soláňský hřbet | D35: 937.9 | E35: yes | F35: 49.4002744N, 18.3341528E | G35: 566 | H35: yes | I35: 49.4192056N, 18.3200214E | J35: 561 | K35: yes | L35: 49.4198083N, 18.3181947E | M35: 561 | N35: yes | O35: 49.4198083N, 18.3181947E | P35: 566 | Q35: yes | R35: 49.4192056N, 18.3200214E | S35: yes | T35: no | U35: 2025-05-25 | V35: https://mapy.com/s/ponasamalu
A36: kota | B36: Czech Republic | C36: Soláňský hřbet | D36: 937.3 | E36: yes | F36: 49.4006006N, 18.3337489E | G36: 566 | H36: yes | I36: 49.4192056N, 18.3200214E | J36: 561 | K36: yes | L36: 49.4198083N, 18.3181947E | M36: 561 | N36: yes | O36: 49.4198083N, 18.3181947E | P36: 566 | Q36: yes | R36: 49.4192056N, 18.3200214E | S36: yes | T36: no | U36: 2025-05-25 | V36: https://mapy.com/s/ponasamalu
A37: Roque Chinobre | B37: Spain | C37: Macizo de Anaga | D37: 910 | E37: yes | F37: 28.5586689N, 16.1754478W | G37: 20 | H37: no | I37: 28.5721342N, 16.1921497W | J37: 0 | K37: yes | L37: 28.5752025N, 16.1888828W | M37: 0 | N37: yes | O37: 28.3714628N, 16.8707072W | P37: 130 | Q37: no | R37: 28.3703606N, 16.8482008W | S37: yes | T37: no | U37: 2025-03-14 | V37: https://mapy.com/s/hufategoba
A38: Cumbre del Carrizal | B38: Spain | C38: Macizo de Teno | D38: 909 | E38: yes | F38: 28.3240661N, 16.8541431W | G38: 20 | H38: no | I38: 28.5721342N, 16.1921497W | J38: 0 | K38: yes | L38: 28.5752025N, 16.1888828W | M38: 0 | N38: yes | O38: 28.3714628N, 16.8707072W | P38: 130 | Q38: no | R38: 28.3703606N, 16.8482008W | S38: no | T38: yes | U38: 2025-03-18 | V38: https://mapy.com/s/hufategoba
A39: Anića glavica | B39: Croatia | C39: Dinara | D39: 909 | E39: yes | F39: 44.0933731N, 16.2913767E | G39: 220 | H39: no | I39: 44.0421933N, 16.1996103E | J39: 220 | K39: no | L39: 44.0407992N, 16.2003814E | M39: 220 | N39: no | O39: 44.0449786N, 16.2128928E | P39: 220 | Q39: no | R39: 44.0421933N, 16.1996103E | S39: no | T39: no | U39: 2025-05-10 | V39: https://mapy.com/s/kohosofojo
A40: Anambra | B40: Spain | C40: Macizo de Anaga | D40: 886 | E40: yes | F40: 28.5636586N, 16.1696514W | G40: 20 | H40: no | I40: 28.5721342N, 16.1921497W | J40: 0 | K40: yes | L40: 28.5752025N, 16.1888828W | M40: 0 | N40: yes | O40: 28.3714628N, 16.8707072W | P40: 130 | Q40: no | R40: 28.3703606N, 16.8482008W | S40: yes | T40: no | U40: 2025-03-14 | V40: https://mapy.com/s/hufategoba
A41: Milešovka | B41: Czech Republic | C41: Milešovská část | D41: 836.6 | E41: yes | F41: 50.5547569N, 13.9314164E | G41: 289 | H41: yes | I41: 50.5380172N, 13.9776672E | J41: 287 | K41: yes | L41: 50.5394067N, 13.9774714E | M41: 287 | N41: yes | O41: 50.5394067N, 13.9774714E | P41: 288 | Q41: yes | R41: 50.5382769N, 13.9773975E | S41: no | T41: yes | U41: 2025-05-17 | V41: https://mapy.com/s/nodesuluza
A42: Cabezo del Tejo | B42: Spain | C42: Macizo de Anaga | D42: 821 | E42: yes | F42: 28.5686031N, 16.1701678W | G42: 20 | H42: no | I42: 28.5721342N, 16.1921497W | J42: 0 | K42: yes | L42: 28.5752025N, 16.1888828W | M42: 0 | N42: yes | O42: 28.3714628N, 16.8707072W | P42: 130 | Q42: no | R42: 28.3703606N, 16.8482008W | S42: yes | T42: no | U42: 2025-03-14 | V42: https://mapy.com/s/hufategoba
A43: kota | B43: Spain | C43: Macizo de Anaga | D43: 800 | E43: no | F43: 28.5330961N, 16.2486225W | G43: 20 | H43: no | I43: 28.5721342N, 16.1921497W | J43: 0 | K43: yes | L43: 28.5752025N, 16.1888828W | M43: 0 | N43: yes | O43: 28.3714628N, 16.8707072W | P43: 130 | Q43: no | R43: 28.3703606N, 16.8482008W | S43: yes | T43: no | U43: 2025-03-14 | V43: https://mapy.com/s/hufategoba
A44: Signal de Botrange | B44: Belgium | C44: Hohes Venn | D44: 694 | E44: yes | F44: 50.5016861N, 6.0925936E | G44: 47 | H44: yes | I44: 50.8504928N, 5.7051403E | J44: 47 | K44: yes | L44: 50.8504928N, 5.7051403E | M44: 60 | N44: no | O44: 50.7384406N, 5.6922725E | P44: 60 | Q44: no | R44: 50.7384406N, 5.6922725E | S44: yes | T44: no | U44: 2025-05-03 | V44: https://mapy.com/s/dedasapogo
A45: (Mont Rigi) | B45: Belgium | C45: Hohes Venn | D45: 681 | E45: yes | F45: 50.5148431N, 6.0703606E | G45: 47 | H45: yes | I45: 50.8504928N, 5.7051403E | J45: 47 | K45: yes | L45: 50.8504928N, 5.7051403E | M45: 60 | N45: no | O45: 50.7384406N, 5.6922725E | P45: 60 | Q45: no | R45: 50.7384406N, 5.6922725E | S45: no | T45: yes | U45: 2025-05-03 | V45: https://mapy.com/s/dedasapogo
A46: kota | B46: Czech Republic | C46: Milešovská část | D46: 595 | E46: no | F46: 50.5565186N, 13.9404258E | G46: 289 | H46: yes | I46: 50.5380172N, 13.9776672E | J46: 287 | K46: yes | L46: 50.5394067N, 13.9774714E | M46: 287 | N46: yes | O46: 50.5394067N, 13.9774714E | P46: 288 | Q46: yes | R46: 50.5382769N, 13.9773975E | S46: no | T46: no | U46: 2025-05-17 | V46: https://mapy.com/s/nodesuluza
A47: kota | B47: Czech Republic | C47: Milešovská část | D47: 586.6 | E47: yes | F47: 50.5552767N, 13.9409867E | G47: 289 | H47: yes | I47: 50.5380172N, 13.9776672E | J47: 287 | K47: yes | L47: 50.5394067N, 13.9774714E | M47: 287 | N47: yes | O47: 50.5394067N, 13.9774714E | P47: 288 | Q47: yes | R47: 50.5382769N, 13.9773975E | S47: yes | T47: no | U47: 2025-05-17 | V47: https://mapy.com/s/nodesuluza
A48: Bindowa Kępa | B48: Poland | C48: Kotlina Żywiecka | D48: 574.7 | E48: yes | F48: 49.6718911N, 19.0810572E | G48: 490 | H48: no | I48: 49.6737494N, 19.0952203E | J48: 470 | K48: no | L48: 49.6776547N, 19.0914383E | M48: 470 | N48: no | O48: 49.6777056N, 19.0915400E | P48: 490 | Q48: no | R48: 49.6737494N, 19.0952203E | S48: yes | T48: no | U48: 2025-02-23 | V48: https://mapy.com/s/buveduvume
A49: kota | B49: Czech Republic | C49: Milešovská část | D49: 548 | E49: yes | F49: 50.5526467N, 13.9421372E | G49: 289 | H49: yes | I49: 50.5380172N, 13.9776672E | J49: 287 | K49: yes | L49: 50.5394067N, 13.9774714E | M49: 287 | N49: yes | O49: 50.5394067N, 13.9774714E | P49: 288 | Q49: yes | R49: 50.5382769N, 13.9773975E | S49: yes | T49: no | U49: 2025-05-17 | V49: https://mapy.com/s/nodesuluza
A50: Holý | B50: Czech Republic | C50: Netvořická pahorkatina | D50: 516.4 | E50: yes | F50: 49.8101408N, 14.4838550E | G50: 205 | H50: yes | I50: 49.8518661N, 14.4061928E | J50: 205 | K50: yes | L50: 49.8518661N, 14.4061928E | M50: 203 | N50: yes | O50: 49.8781067N, 14.4274522E | P50: 225 | Q50: yes | R50: 49.8793961N, 14.4285517E | S50: yes | T50: no | U50: 2025-02-08 | V50: https://mapy.com/s/mazuranaja
A51: kota | B51: Czech Republic | C51: Netvořická pahorkatina | D51: 483.4 | E51: yes | F51: 49.8152542N, 14.4830189E | G51: 205 | H51: yes | I51: 49.8518661N, 14.4061928E | J51: 205 | K51: yes | L51: 49.8518661N, 14.4061928E | M51: 203 | N51: yes | O51: 49.8781067N, 14.4274522E | P51: 225 | Q51: yes | R51: 49.8793961N, 14.4285517E | S51: no | T51: no | U51: 2025-02-08 | V51: https://mapy.com/s/mazuranaja
A52: (Pod Střeškovem) | B52: Czech Republic | C52: Netvořická pahorkatina | D52: 478.7 | E52: yes | F52: 49.8228114N, 14.4768061E | G52: 205 | H52: yes | I52: 49.8518661N, 14.4061928E | J52: 205 | K52: yes | L52: 49.8518661N, 14.4061928E | M52: 203 | N52: yes | O52: 49.8781067N, 14.4274522E | P52: 225 | Q52: yes | R52: 49.8793961N, 14.4285517E | S52: yes | T52: no | U52: 2025-02-08 | V52: https://mapy.com/s/mazuranaja
A53: kota | B53: Czech Republic | C53: Netvořická pahorkatina | D53: 472.6 | E53: yes | F53: 49.8142708N, 14.4922381E | G53: 205 | H53: yes | I53: 49.8518661N, 14.4061928E | J53: 205 | K53: yes | L53: 49.8518661N, 14.4061928E | M53: 203 | N53: yes | O53: 49.8781067N, 14.4274522E | P53: 225 | Q53: yes | R53: 49.8793961N, 14.4285517E | S53: no | T53: no | U53: 2025-02-08 | V53: https://mapy.com/s/mazuranaja
A54: Rozhľadňa | B54: Slovakia | C54: Zemplínske vrchy | D54: 469.6 | E54: yes | F54: 48.4762864N, 21.7066508E | G54: 102 | H54: no | I54: 48.4031856N, 21.6667464E | J54: 102 | K54: no | L54: 48.4004294N, 21.6667878E | M54: 102 | N54: no | O54: 48.4004294N, 21.6667878E | P54: 102 | Q54: no | R54: 48.4024947N, 21.6668025E | S54: yes | T54: no | U54: 2025-03-09 | V54: https://mapy.com/s/camujacusa
A55: kota | B55: Slovakia | C55: Zemplínske vrchy | D55: 465 | E55: yes | F55: 48.4697497N, 21.7127622E | G55: 102 | H55: no | I55: 48.4031856N, 21.6667464E | J55: 102 | K55: no | L55: 48.4004294N, 21.6667878E | M55: 102 | N55: no | O55: 48.4004294N, 21.6667878E | P55: 102 | Q55: no | R55: 48.4024947N, 21.6668025E | S55: yes | T55: no | U55: 2025-03-09 | V55: https://mapy.com/s/camujacusa
A56: kota | B56: Czech Republic | C56: Netvořická pahorkatina | D56: 448.4 | E56: yes | F56: 49.8305164N, 14.4723075E | G56: 205 | H56: yes | I56: 49.8518661N, 14.4061928E | J56: 205 | K56: yes | L56: 49.8518661N, 14.4061928E | M56: 203 | N56: yes | O56: 49.8781067N, 14.4274522E | P56: 225 | Q56: yes | R56: 49.8793961N, 14.4285517E | S56: no | T56: no | U56: 2025-02-08 | V56: https://mapy.com/s/mazuranaja
A57: Chlum | B57: Czech Republic | C57: Rabyňská vrchovina | D57: 446.7 | E57: yes | F57: 49.8616842N, 14.4444886E | G57: 205 | H57: yes | I57: 49.8518661N, 14.4061928E | J57: 205 | K57: yes | L57: 49.8518661N, 14.4061928E | M57: 203 | N57: yes | O57: 49.8781067N, 14.4274522E | P57: 225 | Q57: yes | R57: 49.8793961N, 14.4285517E | S57: yes | T57: no | U57: 2025-02-08 | V57: https://mapy.com/s/mazuranaja
A58: kota | B58: Czech Republic | C58: Kamenopřívozská pahorkatina | D58: 418 | E58: no | F58: 49.8355367N, 14.4906906E | G58: 205 | H58: yes | I58: 49.8518661N, 14.4061928E | J58: 205 | K58: yes | L58: 49.8518661N, 14.4061928E | M58: 203 | N58: yes | O58: 49.8781067N, 14.4274522E | P58: 225 | Q58: yes | R58: 49.8793961N, 14.4285517E | S58: no | T58: no | U58: 2025-02-07 | V58: https://mapy.com/s/mazuranaja
A59: Medník | B59: Czech Republic | C59: Rabyňská vrchovina | D59: 416.5 | E59: yes | F59: 49.8705397N, 14.4433214E | G59: 205 | H59: yes | I59: 49.8518661N, 14.4061928E | J59: 205 | K59: yes | L59: 49.8518661N, 14.4061928E | M59: 203 | N59: yes | O59: 49.8781067N, 14.4274522E | P59: 225 | Q59: yes | R59: 49.8793961N, 14.4285517E | S59: yes | T59: no | U59: 2025-02-08 | V59: https://mapy.com/s/mazuranaja
A60: Habrovka | B60: Czech Republic | C60: Kamenopřívozská pahorkatina | D60: 416.3 | E60: yes | F60: 49.8399992N, 14.4871594E | G60: 205 | H60: yes | I60: 49.8518661N, 14.4061928E | J60: 205 | K60: yes | L60: 49.8518661N, 14.4061928E | M60: 203 | N60: yes | O60: 49.8781067N, 14.4274522E | P60: 225 | Q60: yes | R60: 49.8793961N, 14.4285517E | S60: no | T60: no | U60: 2025-02-07 | V60: https://mapy.com/s/mazuranaja
A61: (Habrovka – JV vrchol) | B61: Czech Republic | C61: Kamenopřívozská pahorkatina | D61: 416 | E61: no | F61: 49.8397097N, 14.4881061E | G61: 205 | H61: yes | I61: 49.8518661N, 14.4061928E | J61: 205 | K61: yes | L61: 49.8518661N, 14.4061928E | M61: 203 | N61: yes | O61: 49.8781067N, 14.4274522E | P61: 225 | Q61: yes | R61: 49.8793961N, 14.4285517E | S61: yes | T61: no | U61: 2025-02-07 | V61: https://mapy.com/s/mazuranaja
A62: kota | B62: Czech Republic | C62: Kamenopřívozská pahorkatina | D62: 415.4 | E62: yes | F62: 49.8367497N, 14.4832889E | G62: 205 | H62: yes | I62: 49.8518661N, 14.4061928E | J62: 205 | K62: yes | L62: 49.8518661N, 14.4061928E | M62: 203 | N62: yes | O62: 49.8781067N, 14.4274522E | P62: 225 | Q62: yes | R62: 49.8793961N, 14.4285517E | S62: yes | T62: no | U62: 2025-02-07 | V62: https://mapy.com/s/mazuranaja
A63: kota | B63: Czech Republic | C63: Kamenopřívozská pahorkatina | D63: 415.1 | E63: yes | F63: 49.8368536N, 14.4906958E | G63: 205 | H63: yes | I63: 49.8518661N, 14.4061928E | J63: 205 | K63: yes | L63: 49.8518661N, 14.4061928E | M63: 203 | N63: yes | O63: 49.8781067N, 14.4274522E | P63: 225 | Q63: yes | R63: 49.8793961N, 14.4285517E | S63: no | T63: no | U63: 2025-02-07 | V63: https://mapy.com/s/mazuranaja
A64: (Habrovka – SV vrchol) | B64: Czech Republic | C64: Kamenopřívozská pahorkatina | D64: 415 | E64: no | F64: 49.8405925N, 14.4879956E | G64: 205 | H64: yes | I64: 49.8518661N, 14.4061928E | J64: 205 | K64: yes | L64: 49.8518661N, 14.4061928E | M64: 203 | N64: yes | O64: 49.8781067N, 14.4274522E | P64: 225 | Q64: yes | R64: 49.8793961N, 14.4285517E | S64: no | T64: no | U64: 2025-02-07 | V64: https://mapy.com/s/mazuranaja
A65: Šiberný | B65: Czech Republic | C65: Netvořická pahorkatina | D65: 414.2 | E65: yes | F65: 49.8238092N, 14.5168361E | G65: 205 | H65: yes | I65: 49.8518661N, 14.4061928E | J65: 205 | K65: yes | L65: 49.8518661N, 14.4061928E | M65: 203 | N65: yes | O65: 49.8781067N, 14.4274522E | P65: 225 | Q65: yes | R65: 49.8793961N, 14.4285517E | S65: yes | T65: no | U65: 2025-02-08 | V65: https://mapy.com/s/mazuranaja
A66: Kabát | B66: Czech Republic | C66: Rabyňská vrchovina | D66: 397.9 | E66: yes | F66: 49.8520072N, 14.4724325E | G66: 205 | H66: yes | I66: 49.8518661N, 14.4061928E | J66: 205 | K66: yes | L66: 49.8518661N, 14.4061928E | M66: 203 | N66: yes | O66: 49.8781067N, 14.4274522E | P66: 225 | Q66: yes | R66: 49.8793961N, 14.4285517E | S66: yes | T66: no | U66: 2025-02-08 | V66: https://mapy.com/s/mazuranaja
A67: Veselý vrch | B67: Czech Republic | C67: Kamenopřívozská pahorkatina | D67: 368.2 | E67: yes | F67: 49.8430375N, 14.5017747E | G67: 205 | H67: yes | I67: 49.8518661N, 14.4061928E | J67: 205 | K67: yes | L67: 49.8518661N, 14.4061928E | M67: 203 | N67: yes | O67: 49.8781067N, 14.4274522E | P67: 225 | Q67: yes | R67: 49.8793961N, 14.4285517E | S67: yes | T67: no | U67: 2025-02-07 | V67: https://mapy.com/s/mazuranaja
A68: kota | B68: Belgium | C68: Pays de Herve | D68: 350 | E68: yes | F68: 50.7444100N, 6.0327978E | G68: 47 | H68: yes | I68: 50.8504928N, 5.7051403E | J68: 47 | K68: yes | L68: 50.8504928N, 5.7051403E | M68: 60 | N68: no | O68: 50.7384406N, 5.6922725E | P68: 60 | Q68: no | R68: 50.7384406N, 5.6922725E | S68: no | T68: no | U68: 2025-05-02 | V68: https://mapy.com/s/dedasapogo
A69: (Vaalserberg - W summit) | B69: Netherlands | C69: Plateau Vijlen-Vaals | D69: 323 | E69: no | F69: 50.7549147N, 6.0191775E | G69: 47 | H69: yes | I69: 50.8504928N, 5.7051403E | J69: 47 | K69: yes | L69: 50.8504928N, 5.7051403E | M69: 60 | N69: no | O69: 50.7384406N, 5.6922725E | P69: 60 | Q69: no | R69: 50.7384406N, 5.6922725E | S69: no | T69: no | U69: 2025-05-02 | V69: https://mapy.com/s/dedasapogo
A70: Vaalserberg | B70: Netherlands | C70: Plateau Vijlen-Vaals | D70: 322.4 | E70: yes | F70: 50.7546928N, 6.0207558E | G70: 47 | H70: yes | I70: 50.8504928N, 5.7051403E | J70: 47 | K70: yes | L70: 50.8504928N, 5.7051403E | M70: 60 | N70: no | O70: 50.7384406N, 5.6922725E | P70: 60 | Q70: no | R70: 50.7384406N, 5.6922725E | S70: yes | T70: no | U70: 2025-05-02 | V70: https://mapy.com/s/dedasapogo
A71: kota | B71: Belgium | C71: Hohes Venn | D71: 308 | E71: yes | F71: 50.6045869N, 5.9349789E | G71: 47 | H71: yes | I71: 50.8504928N, 5.7051403E | J71: 47 | K71: yes | L71: 50.8504928N, 5.7051403E | M71: 60 | N71: no | O71: 50.7384406N, 5.6922725E | P71: 60 | Q71: no | R71: 50.7384406N, 5.6922725E | S71: no | T71: yes | U71: 2025-05-02 | V71: https://mapy.com/s/dedasapogo
A72: kota | B72: Belgium | C72: Hohes Venn | D72: 287 | E72: yes | F72: 50.6108931N, 5.9387272E | G72: 47 | H72: yes | I72: 50.8504928N, 5.7051403E | J72: 47 | K72: yes | L72: 50.8504928N, 5.7051403E | M72: 60 | N72: no | O72: 50.7384406N, 5.6922725E | P72: 60 | Q72: no | R72: 50.7384406N, 5.6922725E | S72: no | T72: yes | U72: 2025-05-02 | V72: https://mapy.com/s/dedasapogo
A73: Tarbucka | B73: Slovakia | C73: Tarbucka | D73: 277.5 | E73: yes | F73: 48.3623186N, 21.7894333E | G73: 110 | H73: no | I73: 48.3905403N, 21.7572817E | J73: 94 | K73: no | L73: 48.3855236N, 21.7553047E | M73: 110 | N73: no | O73: 48.3615850N, 21.8060389E | P73: 110 | Q73: no | R73: 48.3615850N, 21.8060389E | S73: yes | T73: no | U73: 2025-03-08 | V73: https://mapy.com/s/dazedepefa
A74: kota | B74: Belgium | C74: Pays de Herve | D74: 250 | E74: no | F74: 50.6837981N, 5.9903303E | G74: 47 | H74: yes | I74: 50.8504928N, 5.7051403E | J74: 47 | K74: yes | L74: 50.8504928N, 5.7051403E | M74: 60 | N74: no | O74: 50.7384406N, 5.6922725E | P74: 60 | Q74: no | R74: 50.7384406N, 5.6922725E | S74: no | T74: yes | U74: 2025-05-02 | V74: https://mapy.com/s/dedasapogo
A75: kota | B75: Italy | C75: Altopiano delle Murge | D75: 229 | E75: yes | F75: 40.7342536N, 17.5779814E | G75: 80 | H75: no | I75: 40.7521528N, 17.5807817E | J75: 80 | K75: no | L75: 40.7521528N, 17.5807817E | M75: 80 | N75: no | O75: 40.7521528N, 17.5807817E | P75: 80 | Q75: no | R75: 40.7521528N, 17.5807817E | S75: no | T75: yes | U75: 2025-04-20 | V75: https://mapy.com/s/govupucosa
A76: Terril de Blegny | B76: Belgium | C76: Pays de Herve | D76: 219 | E76: yes | F76: 50.6884303N, 5.7218089E | G76: 47 | H76: yes | I76: 50.8504928N, 5.7051403E | J76: 47 | K76: yes | L76: 50.8504928N, 5.7051403E | M76: 60 | N76: no | O76: 50.7384406N, 5.6922725E | P76: 60 | Q76: no | R76: 50.7384406N, 5.6922725E | S76: yes | T76: no | U76: 2025-05-04 | V76: https://mapy.com/s/dedasapogo
A77: Gulperberg | B77: Netherlands | C77: Plateau van Crapoel | D77: 157 | E77: yes | F77: 50.8134425N, 5.8995603E | G77: 47 | H77: yes | I77: 50.8504928N, 5.7051403E | J77: 47 | K77: yes | L77: 50.8504928N, 5.7051403E | M77: 60 | N77: no | O77: 50.7384406N, 5.6922725E | P77: 60 | Q77: no | R77: 50.7384406N, 5.6922725E | S77: yes | T77: no | U77: 2025-05-01 | V77: https://mapy.com/s/dedasapogo
A78: (Hradný kopec) | B78: Slovakia | C78: Tarbucka | D78: 123 | E78: no | F78: 48.3587997N, 21.8081175E | G78: 110 | H78: no | I78: 48.3905403N, 21.7572817E | J78: 94 | K78: no | L78: 48.3855236N, 21.7553047E | M78: 110 | N78: no | O78: 48.3615850N, 21.8060389E | P78: 110 | Q78: no | R78: 48.3615850N, 21.8060389E | S78: yes | T78: no | U78: 2025-03-08 | V78: https://mapy.com/s/dazedepefa
C80: Total count | D80: of:=COUNT([.D2:.D78]) -> 77
C81: Total elevation | D81: of:=SUM([.D2:.D78]) -> 76093.1
C82: Average elevation | D82: of:=[.D81]/[.D80] -> 988.222077922078
C83: Median elevation | D83: of:= MEDIAN([.D2:.D78]) -> 886
C84: Total elevation difference | D84: of:=SUM([.D2:.D78]) - SUM([.J2:.J78]) -> 64664.1
C85: Average elevation difference | D85: of:=[.D84]/[.D80] -> 839.793506493507

Sheet: Additional info
A1: Column descriptions
A2: Column | B2: Description
A3: EE | B3: Exact Elevation – Indicates whether given elevation is exactly known or just an estimate
A4: ESE | B4: Exact Starting Elevation – Indicates whether given starting elevation is exactly known or just an estimate
A5: EFE | B5: Exact Final Elevation – Indicates whether given final elevation is exactly known or just an estimate
A6: CT | B6: Clear Top – Indicates whether the top has marking or is obvious
A7: VA | B7: Visit Again – Indicates whether I need to visit it again to count it as climbed properly or to confirm exact location of the top
A8: MVD | B8: Most Valuable Date – Date of the most valuable climb to this top
A9: MVR | B9: Most Valuable Route – Route that was used to ge to the top on MVD
A10: LPBE | B10: Lowest Point Before Elevation – Elevation of the lowest point on the route before reaching the top
A11: ELPBE | B11: Exact Lowest Point Before Elevation – Indicates whether given elevation of the lowest point on the route before reaching the top is exactly known or just an estimate
A12: LPBP | B12: Lowest Point Before Point – Coordinates of the lowest point on the route before reaching the top
A13: LPAE | B13: Lowest Point After Elevation – Elevation of the lowest point on the route after reaching the top
A14: ELPAE | B14: Exact Lowest Point After Elevation – Indicates whether given elevation of the lowest point on the route after reaching the top is exactly known or just an estimate
A15: LPAP | B15: Lowest Point After Point – Coordinates of the lowest point on the route after reaching the top
A17: Column values
A18: Column | B18: Value pattern | C18: Description
A19: Name | B19: (…) | C19: Name invented by me
A20: Name | B20: kota | C20: Without name